{
  "schema_version": "1.0.0",
  "project_id": "proj-demo-001",
  "created_at": "2026-09-20T12:00:00Z",
  "brief_ref": "brief/brief.md",
  "asset_ids": [
    "ast_a1b2c3d4e5f6"
  ],
  "reference_set_ids": [
    "rset_anna00000001"
  ],
  "lock_policy": {
    "PERSON_LOCK": {
      "enabled": true,
      "reference_set_id": "rset_anna00000001",
      "reference_set_sha256": "a1b52c5a88e3afc18884d53e8a2dce61a03ac75e1043206571bb777cc1132df8",
      "on_drift": "qc_fail"
    },
    "STYLE_LOCK": {
      "enabled": false
    }
  },
  "cost_decisions": [
    {
      "step": "analyse",
      "cost_class": "local_deterministic",
      "known_cost": null,
      "quota_status": "ok",
      "fallback_reason": null,
      "approval_required": false
    },
    {
      "step": "video_generation_test",
      "cost_class": "premium",
      "known_cost": {
        "amount": 5,
        "currency": "EUR",
        "unit": "credit"
      },
      "quota_status": "unknown",
      "fallback_reason": "Lokal keine Referenztreue moeglich",
      "approval_required": true,
      "approval_status": "pending"
    }
  ],
  "delivery_targets": [
    {
      "platform": "reels",
      "profile": "1080x1920",
      "asset_id": "ast_d1d2d3d4d5d6"
    }
  ],
  "provenance_status": "internal_hash_graph",
  "ai_labeling_status": "not_assessed"
}
